{
  "schemaVersion": 1,
  "snapshotType": "filled-form",
  "scenarioId": "elena-marquez-i9-template-smoke",
  "userId": "elena-marquez",
  "corpusId": "template-smoke",
  "formId": "i-9",
  "response": {
    "status": "partial",
    "originalFilename": "form.pdf",
    "outputFilename": "filled-form.pdf",
    "outputMimeType": "application/pdf"
  },
  "summary": {
    "totalFields": 48,
    "filledCount": 13,
    "skippedCount": 35,
    "plannedActionCounts": {
      "SET_TEXT": 11,
      "CHECK": 1,
      "UNCHECK": 0,
      "SELECT_OPTION": 1,
      "SKIP": 35
    },
    "warnings": []
  },
  "fields": [
    {
      "fieldIndex": 0,
      "pdfFieldName": "3 A lawful permanent resident Enter USCIS or ANumber",
      "fieldType": "text",
      "generated": {
        "inferredLabel": "Citizenship or immigration status",
        "inferredDataKey": "identity.citizenship_status",
        "optionSetId": null,
        "optionCount": 0
      },
      "fieldMap": {
        "mode": "fact",
        "factKey": "workAuthorization.uscisANumber",
        "when": {
          "factKey": "workAuthorization.citizenshipStatus",
          "equals": "lawful permanent resident"
        },
        "note": "I-9 lawful permanent resident A-number branch."
      },
      "expected": {
        "action": "SKIP",
        "value": null,
        "sourceSlugs": [],
        "confidence": 0.99,
        "skipReason": "field-map:conditional_inactive",
        "skipKind": "conditional-inactive"
      },
      "actual": {
        "value": "",
        "selected": [],
        "checked": null,
        "filled": false,
        "skippedReason": "field-map:conditional_inactive",
        "sourceSlugs": [],
        "confidence": 0.99
      },
      "classification": "skipped-correctly"
    },
    {
      "fieldIndex": 1,
      "pdfFieldName": "Signature of Employee",
      "fieldType": "text",
      "generated": {
        "inferredLabel": "Signature, consent, or attestation",
        "inferredDataKey": "legal.signature_or_attestation",
        "optionSetId": null,
        "optionCount": 0
      },
      "fieldMap": {
        "mode": "skip",
        "reason": "manual_attestation",
        "note": "Employee signature requires explicit action for the current form run."
      },
      "expected": {
        "action": "SKIP",
        "value": null,
        "sourceSlugs": [],
        "confidence": 0.99,
        "skipReason": "field-map:manual_attestation"
      },
      "actual": {
        "value": "",
        "selected": [],
        "checked": null,
        "filled": false,
        "skippedReason": "field-map:manual_attestation",
        "sourceSlugs": [],
        "confidence": 0.99
      },
      "classification": "skipped-correctly"
    },
    {
      "fieldIndex": 2,
      "pdfFieldName": "First Name Given Name",
      "fieldType": "text",
      "generated": {
        "inferredLabel": "First name",
        "inferredDataKey": "identity.first_name",
        "optionSetId": null,
        "optionCount": 0
      },
      "fieldMap": {
        "mode": "fact",
        "factKey": "identity.firstName"
      },
      "expected": {
        "action": "SET_TEXT",
        "value": "Elena",
        "sourceSlugs": [
          "profile.first_name"
        ],
        "confidence": 0.99,
        "skipReason": null
      },
      "actual": {
        "value": "Elena",
        "selected": [],
        "checked": null,
        "filled": true,
        "skippedReason": null,
        "sourceSlugs": [
          "profile.first_name"
        ],
        "confidence": 0.99
      },
      "classification": "correct"
    },
    {
      "fieldIndex": 3,
      "pdfFieldName": "Employee Middle Initial (if any)",
      "fieldType": "text",
      "generated": {
        "inferredLabel": "Middle name or initial",
        "inferredDataKey": "identity.middle_name_or_initial",
        "optionSetId": null,
        "optionCount": 0
      },
      "fieldMap": {
        "mode": "fact",
        "factKey": "identity.middleInitial"
      },
      "expected": {
        "action": "SET_TEXT",
        "value": "S",
        "sourceSlugs": [
          "eval.identity.middle_initial"
        ],
        "confidence": 0.99,
        "skipReason": null
      },
      "actual": {
        "value": "S",
        "selected": [],
        "checked": null,
        "filled": true,
        "skippedReason": null,
        "sourceSlugs": [
          "eval.identity.middle_initial"
        ],
        "confidence": 0.99
      },
      "classification": "correct"
    },
    {
      "fieldIndex": 4,
      "pdfFieldName": "Employee Other Last Names Used (if any)",
      "fieldType": "text",
      "generated": {
        "inferredLabel": "Last name",
        "inferredDataKey": "identity.last_name",
        "optionSetId": null,
        "optionCount": 0
      },
      "fieldMap": {
        "mode": "fact",
        "factKey": "identity.otherLastNames"
      },
      "expected": {
        "action": "SET_TEXT",
        "value": "Ruiz",
        "sourceSlugs": [
          "eval.identity.other_last_names"
        ],
        "confidence": 0.99,
        "skipReason": null
      },
      "actual": {
        "value": "Ruiz",
        "selected": [],
        "checked": null,
        "filled": true,
        "skippedReason": null,
        "sourceSlugs": [
          "eval.identity.other_last_names"
        ],
        "confidence": 0.99
      },
      "classification": "correct"
    },
    {
      "fieldIndex": 5,
      "pdfFieldName": "Today's Date mmddyyy",
      "fieldType": "text",
      "generated": {
        "inferredLabel": "Date",
        "inferredDataKey": "date.generic",
        "optionSetId": null,
        "optionCount": 0
      },
      "fieldMap": {
        "mode": "skip",
        "reason": "manual_attestation",
        "note": "Employee signature date is part of the attestation and should not be filled from stored memory."
      },
      "expected": {
        "action": "SKIP",
        "value": null,
        "sourceSlugs": [],
        "confidence": 0.99,
        "skipReason": "field-map:manual_attestation"
      },
      "actual": {
        "value": "",
        "selected": [],
        "checked": null,
        "filled": false,
        "skippedReason": "field-map:manual_attestation",
        "sourceSlugs": [],
        "confidence": 0.99
      },
      "classification": "skipped-correctly"
    },
    {
      "fieldIndex": 6,
      "pdfFieldName": "List B Document 1 Title",
      "fieldType": "text",
      "generated": {
        "inferredLabel": "Employment authorization document",
        "inferredDataKey": "employment.document",
        "optionSetId": null,
        "optionCount": 0
      },
      "fieldMap": {
        "mode": "skip",
        "reason": "out_of_scope",
        "note": "Section 2 List B document fields are employer or authorized-representative review fields."
      },
      "expected": {
        "action": "SKIP",
        "value": null,
        "sourceSlugs": [],
        "confidence": 0.99,
        "skipReason": "field-map:out_of_scope"
      },
      "actual": {
        "value": "",
        "selected": [],
        "checked": null,
        "filled": false,
        "skippedReason": "field-map:out_of_scope",
        "sourceSlugs": [],
        "confidence": 0.99
      },
      "classification": "skipped-correctly"
    },
    {
      "fieldIndex": 7,
      "pdfFieldName": "Additional Information",
      "fieldType": "text",
      "generated": {
        "inferredLabel": "Additional Information",
        "inferredDataKey": "unmapped.needs_review",
        "optionSetId": null,
        "optionCount": 0
      },
      "fieldMap": {
        "mode": "skip",
        "reason": "unmapped",
        "note": "Additional Information has no canonical Section 1 profile fact in this scenario."
      },
      "expected": {
        "action": "SKIP",
        "value": null,
        "sourceSlugs": [],
        "confidence": 0.99,
        "skipReason": "field-map:unmapped"
      },
      "actual": {
        "value": "",
        "selected": [],
        "checked": null,
        "filled": false,
        "skippedReason": "field-map:unmapped",
        "sourceSlugs": [],
        "confidence": 0.99
      },
      "classification": "skipped-correctly"
    },
    {
      "fieldIndex": 8,
      "pdfFieldName": "CB_1",
      "fieldType": "checkbox",
      "generated": {
        "inferredLabel": "CB 1",
        "inferredDataKey": "unmapped.needs_review",
        "optionSetId": null,
        "optionCount": 0
      },
      "fieldMap": {
        "mode": "fact",
        "factKey": "workAuthorization.citizenshipStatus",
        "when": {
          "factKey": "workAuthorization.citizenshipStatus",
          "equals": "U.S. citizen"
        },
        "note": "I-9 citizenship checkbox for U.S. citizen."
      },
      "expected": {
        "action": "CHECK",
        "value": null,
        "sourceSlugs": [
          "eval.work_authorization.citizenship_status"
        ],
        "confidence": 0.99,
        "skipReason": null
      },
      "actual": {
        "value": null,
        "selected": [],
        "checked": true,
        "filled": true,
        "skippedReason": null,
        "sourceSlugs": [
          "eval.work_authorization.citizenship_status"
        ],
        "confidence": 0.99
      },
      "classification": "correct"
    },
    {
      "fieldIndex": 9,
      "pdfFieldName": "CB_2",
      "fieldType": "checkbox",
      "generated": {
        "inferredLabel": "CB 2",
        "inferredDataKey": "unmapped.needs_review",
        "optionSetId": null,
        "optionCount": 0
      },
      "fieldMap": {
        "mode": "fact",
        "factKey": "workAuthorization.citizenshipStatus",
        "when": {
          "factKey": "workAuthorization.citizenshipStatus",
          "equals": "noncitizen national"
        },
        "note": "I-9 citizenship checkbox for noncitizen national."
      },
      "expected": {
        "action": "SKIP",
        "value": null,